{
  "tempPassword": {
    "sendEmail": false,
    "emailConfig": {
    }
  },
  "authorisedList": [
    {
      "project": "finos",
      "name": "git-proxy",
      "url": "https://github.com/finos/git-proxy.git"
    },
    {
      "project": "coopernetes",
      "name": "test-repo",
      "url": "https://github.com/coopernetes/test-repo.git"
    }
  ],
  "sink": [
    {
      "type": "fs",
      "params": {
        "filepath": "./."
      },
      "enabled": true
    },
    {
      "type": "mongo",
      "connectionString": "mongodb://localhost:27017/gitproxy",
      "options": {        
        "useUnifiedTopology": true
      },      
      "enabled": false
    }
  ],
  "authentication": [
    {
      "type": "local",
      "enabled": true
    }
  ]
}
